id,system,st_surrogate,regime_name,phenomenon,my_interpretation,authors_interpretation,similarity,difference,action,z_score,is_g11c_passed
Phys_1_URu2Si2_Bstar,URu2Si2 (Heavy-Fermion HO/LMAFM transition),0.22,PROTECTED COHERENT (Согласованный защищённый),Сдвиг критического поля B_star(p) при переходе между Скрытым Порядком (HO) и Антиферромагнетизмом (LMAFM).,Система 'торгует' магнитной поляризацией против lattice strain. B_star является боттлнеком примирения фаз. Колебания вблизи B_star — это динамическое переключение ролей параметров порядка.,Простой фазовый переход первого рода. Колебания сопротивления у границы фаз списываются на несовершенство кристаллической решетки образца и усредняются.,Обе трактовки фиксируют резкую перестройку проводимости и смещение критической точки под давлением.,Авторы усредняют флуктуации как приборный шум. Наш фреймворк видит во флуктуациях точки принятия топологических решений системой на границе конкурирующих фаз.,Анализировать d2R/dB2 без сглаживания. Построить траекторию B_star в пространстве T-p-B как линию квантового компромисса.,11.500907578151281,True
Phys_2_Bi2201_STM,Bi2201 (High-Tc Superconductor STM Gap maps),0.29,BOUNDARY ZONE (Пограничная зона перехода),Пространственная наномасштабная неоднородность сверхпроводящей щели Delta(r) на картах туннельной проводимости STM.,Пространственная торговля фазовой когерентностью. Пятнистость — это карта распределения адаптационной нагрузки купратного слоя. Каждое нано-пятно — локальное компромиссное решение сверхпроводимости с дефектами.,Локальное подавление сверхпроводимости случайным беспорядком примесей кислорода. Спектры усредняются по площади для получения идеальной BCS-кривой.,Согласие в наличии сильной пространственной неоднородности спектров туннельной проводимости.,"Авторы считают пятнистость нежелательным шумом синтеза. Мы доказываем, что геометрия пятен — это строго структурированный коридор согласования сверхпроводимости с примесным каркасом.",Расчет пространственной автокорреляционной функции флуктуаций щели Delta(r) вместо глобального усреднения спектров.,10.450740435525214,True
Phys_3_La4Ni3O10_CDW,La4Ni3O10 (Trilayer Nickelate CDW transitions),0.32,BOUNDARY ZONE (Пограничная зона перехода),Ступенчатые аномалии и изломы проводимости (CDW) под давлением с задержкой восстановления (delayed recovery).,Боттлнек перераспределения зарядовой плотности. Внутренняя плоскость NiO2 торгует зарядом с внешними плоскостями (dimensionality flow). Изломы на CDW — точки соглашения магнитных и проводящих сил.,"Паразитное подавление CDW-нестабильности давлением, мешающее выходу в чистое сверхпроводящее состояние.",Обе концепции фиксируют исчезновение излома CDW на температурных кривых сопротивления при высоких давлениях.,"Авторы фитируют фоновое сопротивление степенным законом, отбрасывая CDW-изломы как погрешность. Мы трактуем CDW-излом как важнейший индикатор торгового компромисса между плоскими слоями.","Локализовать CDW-переходы по максимумам производной dR/dT, картируя 'поток размерности' под давлением.",10.729031273999617,True
Phys_4_Graphene_UCF,Graphene SOC (Universal Conductance Fluctuations),0.23,PROTECTED COHERENT (Согласованный защищённый),Универсальные флуктуации проводимости (UCF) и квантовый спиновый шум в краевых каналах.,"Топологическая перестройка проводящего хребта (backbone). UCF — это не случайный шум, а отпечаток квантовой интерференции в боттлнеках краевых каналов, отражающий топологическое соглашение сил.",Квантовый интерференционный шум на случайных примесях. Кривые сглаживаются для извлечения классического магнетосопротивления.,Обе стороны фиксируют высокую воспроизводимость 'шумового' рисунка UCF для конкретного образца.,"Авторы отфильтровывают UCF как фоновый шум интерференции. Мы доказываем, что в UCF зашифрован граф связности защищенных каналов под давлением SOC.",Проведение быстрого преобразования Фурье (FFT) шума UCF для извлечения геометрических площадей квантовых петель.,8.909309633811313,True
Phys_5_La3Ni2O7_Bilayer,La3Ni2O7 (Bilayer Nickelate Under High Pressure),0.16,PROTECTED (Защищённый стабильный),Резкое падение сопротивления и появление сверхпроводимости при давлении выше 14 ГПа.,"Открытие анизотропных коридоров согласования. Двумерные плоскости торгуют межслоевой связью, перераспределяя нагрузку спиновых флуктуаций на внутренние trusted manifolds.","Межслоевое спаривание d_z2 орбиталей никеля, подавление магнитных флуктуаций за счет жесткой кристаллической перестройки.","Согласие в том, что межслоевое взаимодействие и решетка являются ключевыми триггерами сверхпроводимости.",Авторы ищут объяснение в электронных парах на орбитальном уровне. Мы смотрим на никелат как на перестройку топологии переноса размерности под экстремальным давлением.,Оценить анизотропию критических полей Hc2 вдоль и поперек слоев для верификации транспортных коридоров.,10.211423080195713,True
